{
  "schema_version": "1.0",
  "model_name": "model_intraday_momentum_trading_with_machine",
  "validation_status": "APPROVED",
  "validation_timestamp": "2026-04-27T16:49:20.549499",
  "code_quality": {
    "issues": [],
    "warnings": [],
    "score": 10
  },
  "anomalies": [],
  "academic_discrepancies": [],
  "risk_return_profile": {
    "expected_return": 0.2835,
    "volatility": 0.1847,
    "sharpe_ratio": 1.427,
    "max_drawdown": 0.0708,
    "win_rate": 0.5308,
    "risk_score": "MEDIUM",
    "return_score": "GOOD",
    "risk_return_ratio": 1.5353
  },
  "statistical_robustness": {
    "mean_return": 0.024806519865876807,
    "std_return": 0.5521989591481439,
    "percentile_5": -0.9033936923408807,
    "percentile_95": 0.7135952692925789,
    "prob_positive_return": 0.54,
    "prob_negative_10": 0.37,
    "coefficient_of_variation": 0.044923155784547066,
    "robustness_score": "LOW"
  }
}